{
  "schemaVersion": 2,
  "contractRevision": "C2",
  "contractDigest": "sha256:396d117206670e7ed9cf44582317a5a9396761793024e74f55823e448e77ffb3",
  "mode": "shared",
  "collectedAt": "2026-09-24T12:00:00Z",
  "timing": { "deadlineScope": "total-including-all-helpers", "deadlineMs": 5000, "elapsedMs": 480, "timedOut": false },
  "problemCode": "runtime_unavailable",
  "failureBoundary": "runtime-contact",
  "facts": {
    "workspace": { "observed": true, "value": "workspace-ref-1", "observedAt": "2026-09-24T12:00:00Z", "unavailableReason": null },
    "runtime": { "observed": true, "value": "unavailable", "observedAt": "2026-09-24T12:00:00Z", "unavailableReason": null },
    "computeWorker": { "observed": false, "value": null, "observedAt": null, "unavailableReason": "Runtime unavailable" },
    "selectedCapability": { "observed": false, "value": null, "observedAt": null, "unavailableReason": "Runtime unavailable" },
    "authorization": { "observed": false, "value": null, "observedAt": null, "unavailableReason": "not observed" },
    "taskState": { "observed": false, "value": null, "observedAt": null, "unavailableReason": "no task selected" },
    "contact": { "observed": true, "value": "unavailable", "observedAt": "2026-09-24T12:00:00Z", "unavailableReason": null },
    "progress": { "observed": false, "value": null, "observedAt": null, "unavailableReason": "no current attempt" },
    "terminalResult": { "observed": false, "value": null, "observedAt": null, "unavailableReason": "no task selected" },
    "providerExecution": { "observed": false, "value": null, "observedAt": null, "unavailableReason": "provider not queried" },
    "providerBilling": { "observed": false, "value": null, "observedAt": null, "unavailableReason": "provider not queried" },
    "optionalContributionAuth": { "observed": false, "value": null, "observedAt": null, "unavailableReason": "outside checked scope" },
    "hostedSessionAndGrants": { "observed": false, "value": null, "observedAt": null, "unavailableReason": "local mode" }
  },
  "limits": { "maxEvents": 200, "maxLogBytes": 65536, "maxBundleBytes": 1048576 },
  "captured": { "events": 0, "logBytes": 0, "bundleBytes": 0 },
  "truncated": false,
  "nextActions": [
    { "commandId": "runtime-up", "arguments": ["--data-root", "<redacted:path>"], "effects": ["start-stop-local-service", "configure-install", "write-relocate-change-data"], "authorizationRequired": true, "executable": false }
  ],
  "actionsExecuted": [],
  "redacted": true
}
